{
  "$schema": "http://json-schema.org/draft-07/schema#",
  "title": "EDGE",
  "type": "object",
  "required": ["from_variable", "to_variable", "sign", "strength", "lag", "confidence"],
  "properties": {
    "from_variable": { "type": "string" },
    "to_variable": { "type": "string" },
    "sign": { "type": "integer", "enum": [1, -1] },
    "strength": { "type": "number", "minimum": 0, "maximum": 1 },
    "lag": { "type": "string", "enum": ["fast", "medium", "slow"] },
    "confidence": { "type": "number", "minimum": 0, "maximum": 1 }
  },
  "additionalProperties": false
}
